{"catalog_version":1,"integrity":{"catalog_sha256":"00c9f4b7014d36bea3ece7053bac24923a0ab739769aba49f34dc3b5fde7ac90","signatures":[]},"items":[{"capabilities":[],"dependencies":[],"files":[{"ownership_class":"brain","path":".claude/skills/account-plan/SKILL.md","sha256":"d2cd653fd1ef7e2c1e0b3ce9b1035e44ab53e68c05bd8bc241ff1a56f504b70e"}],"id":"account-plan","kind":"skill","rewind":{"acknowledgement_required":true,"token":"rewind:account-plan@1.0.0"},"version":"1.0.0"},{"capabilities":[],"dependencies":[],"files":[{"ownership_class":"brain","path":".claude/skills/architecture-decision/SKILL.md","sha256":"0b41531a71c6fdb9f46b9bf4e30440ab24348c89018edec690d738f665d0c5b1"}],"id":"architecture-decision","kind":"skill","rewind":{"acknowledgement_required":true,"token":"rewind:architecture-decision@1.0.0"},"version":"1.0.0"},{"capabilities":[],"dependencies":[],"files":[{"ownership_class":"brain","path":".claude/skills/audience-intel/SKILL.md","sha256":"1666858f2cebfa8c624fefc595c789ef23c9d0590344b741770a70381421eee9"}],"id":"audience-intel","kind":"skill","rewind":{"acknowledgement_required":true,"token":"rewind:audience-intel@1.0.0"},"version":"1.0.0"},{"capabilities":[],"dependencies":[],"files":[{"ownership_class":"brain","path":".claude/skills/board-prep/SKILL.md","sha256":"1b11c57af1d7ca64c2553ed3227630231d9b00bc281104c9e1eb9bf056986543"}],"id":"board-prep","kind":"skill","rewind":{"acknowledgement_required":true,"token":"rewind:board-prep@1.0.0"},"version":"1.0.0"},{"capabilities":[],"dependencies":[],"files":[{"ownership_class":"brain","path":".claude/skills/call-prep/SKILL.md","sha256":"fffdd05c449db5a179da532ffcd464e84e3990582e9f62d943e280e581fabef3"}],"id":"call-prep","kind":"skill","rewind":{"acknowledgement_required":true,"token":"rewind:call-prep@1.0.0"},"version":"1.0.0"},{"capabilities":[],"dependencies":[],"files":[{"ownership_class":"brain","path":".claude/skills/campaign-review/SKILL.md","sha256":"1a89109fc5ceb92e263717227abe9138a264f566bf7540d794044411ee2b9d68"}],"id":"campaign-review","kind":"skill","rewind":{"acknowledgement_required":true,"token":"rewind:campaign-review@1.0.0"},"version":"1.0.0"},{"capabilities":[],"dependencies":[],"files":[{"ownership_class":"brain","path":".claude/skills/close-status/SKILL.md","sha256":"f0f05af3ae46e961a67ec724038a9d5d87398b04e5957b7b637807cbcb383cb0"}],"id":"close-status","kind":"skill","rewind":{"acknowledgement_required":true,"token":"rewind:close-status@1.0.0"},"version":"1.0.0"},{"capabilities":[],"dependencies":[],"files":[{"ownership_class":"brain","path":".claude/skills/content-calendar/SKILL.md","sha256":"abed23d7af08fe03c9d1e0645f62a84ac5a89cbbc276f94ac1a91c9f0b1fbb0d"}],"id":"content-calendar","kind":"skill","rewind":{"acknowledgement_required":true,"token":"rewind:content-calendar@1.0.0"},"version":"1.0.0"},{"capabilities":[],"dependencies":[],"files":[{"ownership_class":"brain","path":".claude/skills/customer-intel/SKILL.md","sha256":"278cc3803c103b445d02ed81db4ea45c244e98dbd56940226361b5b028f6dbbe"}],"id":"customer-intel","kind":"skill","rewind":{"acknowledgement_required":true,"token":"rewind:customer-intel@1.0.0"},"version":"1.0.0"},{"capabilities":[],"dependencies":[],"files":[{"ownership_class":"brain","path":".claude/skills/deal-review/SKILL.md","sha256":"ba3ae9d78968990c944021d61d4119bbd3d4238c8811fd26b467c3c625b1028c"}],"id":"deal-review","kind":"skill","rewind":{"acknowledgement_required":true,"token":"rewind:deal-review@1.0.0"},"version":"1.0.0"},{"capabilities":[],"dependencies":[],"files":[{"ownership_class":"brain","path":".claude/skills/decision-log/SKILL.md","sha256":"e6c5d64940fe7135bfacd06aebcffae7ac40ca0f1971503b6f4a46551c505283"}],"id":"decision-log","kind":"skill","rewind":{"acknowledgement_required":true,"token":"rewind:decision-log@1.0.0"},"version":"1.0.0"},{"capabilities":[],"dependencies":[],"files":[{"ownership_class":"brain","path":".claude/skills/delegate-check/SKILL.md","sha256":"c4cc8a0bb2c7b48edddf3aa809a0756fa123fb6f6be8c60076357454b96edc34"}],"id":"delegate-check","kind":"skill","rewind":{"acknowledgement_required":true,"token":"rewind:delegate-check@1.0.0"},"version":"1.0.0"},{"capabilities":[],"dependencies":[],"files":[{"ownership_class":"brain","path":".claude/skills/design-review/SKILL.md","sha256":"60138c6f26f5db7332f2b8038c2c8f1b66b2d43befd6eab348d1b8bc0eaa328b"}],"id":"design-review","kind":"skill","rewind":{"acknowledgement_required":true,"token":"rewind:design-review@1.0.0"},"version":"1.0.0"},{"capabilities":[],"dependencies":[],"files":[{"ownership_class":"brain","path":".claude/skills/design-system-audit/SKILL.md","sha256":"e338e34e57bbcd831cf1ca909426c76e084523debcc45fa6f1629b4c464ab9a4"}],"id":"design-system-audit","kind":"skill","rewind":{"acknowledgement_required":true,"token":"rewind:design-system-audit@1.0.0"},"version":"1.0.0"},{"capabilities":[],"dependencies":[],"files":[{"ownership_class":"brain","path":".claude/skills/expansion-opportunities/SKILL.md","sha256":"0e8e42f1fc9983175dd8245a62cd6e36c794cf012f6acec656b1c3694070ca50"}],"id":"expansion-opportunities","kind":"skill","rewind":{"acknowledgement_required":true,"token":"rewind:expansion-opportunities@1.0.0"},"version":"1.0.0"},{"capabilities":[],"dependencies":[],"files":[{"ownership_class":"brain","path":".claude/skills/feature-decision/SKILL.md","sha256":"ebc676bc5c3b6961cef835f9e39cc7552fd3aa269f38f5731d3014cffe63a39a"}],"id":"feature-decision","kind":"skill","rewind":{"acknowledgement_required":true,"token":"rewind:feature-decision@1.0.0"},"version":"1.0.0"},{"capabilities":[],"dependencies":[],"files":[{"ownership_class":"brain","path":".claude/skills/health-score/SKILL.md","sha256":"56dbe43dabf8f9c9c149e54bd2e98f2dcaf297fc12c73aac3b697fb749bcdf45"}],"id":"health-score","kind":"skill","rewind":{"acknowledgement_required":true,"token":"rewind:health-score@1.0.0"},"version":"1.0.0"},{"capabilities":[],"dependencies":[],"files":[{"ownership_class":"brain","path":".claude/skills/incident-review/SKILL.md","sha256":"c2d0500ba3566e4515cf479cbf5fbd111d55f3dcc38a2b48dc2e4aa28858e5a2"}],"id":"incident-review","kind":"skill","rewind":{"acknowledgement_required":true,"token":"rewind:incident-review@1.0.0"},"version":"1.0.0"},{"capabilities":[],"dependencies":[],"files":[{"ownership_class":"brain","path":".claude/skills/messaging-audit/SKILL.md","sha256":"b99d3a50f2c23af62d449063e97250d5ee26256814acacacd6043dc7a5eed9f9"}],"id":"messaging-audit","kind":"skill","rewind":{"acknowledgement_required":true,"token":"rewind:messaging-audit@1.0.0"},"version":"1.0.0"},{"capabilities":[],"dependencies":[],"files":[{"ownership_class":"brain","path":".claude/skills/metrics-review/SKILL.md","sha256":"7438487377b943f2d31f85ae93300fe8a5d3df3fd75d0d32f2ee7404812a0f8e"}],"id":"metrics-review","kind":"skill","rewind":{"acknowledgement_required":true,"token":"rewind:metrics-review@1.0.0"},"version":"1.0.0"},{"capabilities":[],"dependencies":[],"files":[{"ownership_class":"brain","path":".claude/skills/pipeline-health/SKILL.md","sha256":"01fe6fc44271b66178e05400e7be9ba6e526f8552bf8ca1c5732cc7dcf58e961"}],"id":"pipeline-health","kind":"skill","rewind":{"acknowledgement_required":true,"token":"rewind:pipeline-health@1.0.0"},"version":"1.0.0"},{"capabilities":[],"dependencies":[],"files":[{"ownership_class":"brain","path":".claude/skills/process-audit/SKILL.md","sha256":"d00acb5f8188acc1a8b085364f80f5ff17b7c844a3a0cd3f52a9195c21e52b00"}],"id":"process-audit","kind":"skill","rewind":{"acknowledgement_required":true,"token":"rewind:process-audit@1.0.0"},"version":"1.0.0"},{"capabilities":[],"dependencies":[],"files":[{"ownership_class":"brain","path":".claude/skills/renewal-prep/SKILL.md","sha256":"7cc1e84eba0531a5ef2c46ab05ee01906c0323aa29e5a9723cddb1ce6528de5b"}],"id":"renewal-prep","kind":"skill","rewind":{"acknowledgement_required":true,"token":"rewind:renewal-prep@1.0.0"},"version":"1.0.0"},{"capabilities":[],"dependencies":[],"files":[{"ownership_class":"brain","path":".claude/skills/roadmap/SKILL.md","sha256":"9c343ee7112057bbe8f2ca591334e7eb0a8916bb0112957018f8d9a43ca6fe35"}],"id":"roadmap","kind":"skill","rewind":{"acknowledgement_required":true,"token":"rewind:roadmap@1.0.0"},"version":"1.0.0"},{"capabilities":[],"dependencies":[],"files":[{"ownership_class":"brain","path":".claude/skills/tech-debt/SKILL.md","sha256":"3a2b58c655d8e722f7a62ea49299efe3314f62c536a96c95c22776d623ad7a48"}],"id":"tech-debt","kind":"skill","rewind":{"acknowledgement_required":true,"token":"rewind:tech-debt@1.0.0"},"version":"1.0.0"},{"capabilities":[],"dependencies":[],"files":[{"ownership_class":"brain","path":".claude/skills/variance-analysis/SKILL.md","sha256":"4eb250075355e0c2b264fea83e73e1a32dbc6b21f2fc4115db94af7047e9978c"}],"id":"variance-analysis","kind":"skill","rewind":{"acknowledgement_required":true,"token":"rewind:variance-analysis@1.0.0"},"version":"1.0.0"},{"capabilities":[],"dependencies":[],"files":[{"ownership_class":"brain","path":".claude/skills/weekly-reflection/SKILL.md","sha256":"7a8fdd0bf4dfb517bcc076d2f9cc899efa1d678c5efa3f0bd6457d9186ef4ffb"}],"id":"weekly-reflection","kind":"skill","rewind":{"acknowledgement_required":true,"token":"rewind:weekly-reflection@1.0.0"},"version":"1.0.0"}],"release":{"channel":"release","immutable_distribution_tag":"dist/release/v1.96.2-f23caea","manifest":{"path":"System/.installed-files.manifest","sha256":"a32cac28aaa3752c1efc5e04e56755a559b5c046b68ba583f2c393de5bda5694"},"source_commit":"f23caea333a060e0744cffc9b58bbddfc680246c","version":"1.96.2"}}
